{
  "$id": "fields.time",
  "name": "Time",
  "version": "0.4.0",
  "status": "stable",
  "category": "temporal",
  "description": "Time-of-day without an implicit calendar date or timezone.",
  "value": {
    "jsonType": "string",
    "canonical": "ISO local time HH:MM[:SS[.sss]].",
    "absence": "Absent values are represented by omission or null only when nullable is true."
  },
  "cms": {
    "editor": "time",
    "inputMode": "numeric",
    "supportsPlaceholder": false,
    "supportsHelpText": true,
    "supportsWidth": true
  },
  "capabilities": {
    "searchable": true,
    "filterable": true,
    "sortable": true,
    "localizable": false,
    "revisionTracked": true
  },
  "supportedConfig": [
    "key",
    "label",
    "description",
    "helpText",
    "required",
    "nullable",
    "defaultValue",
    "customerEditable",
    "adminEditable",
    "searchable",
    "filterable",
    "sortable",
    "localizable",
    "revisionTracked",
    "conditionalVisibility",
    "width",
    "minimum",
    "maximum"
  ],
  "validationRules": [
    "required",
    "type",
    "notNull",
    "timeFormat"
  ],
  "examples": {
    "valid": [
      "09:30",
      "21:45:30"
    ],
    "invalid": [
      "9:30 PM"
    ]
  },
  "notes": []
}
